{
  "schema_version": "1.0",
  "prompt_id": "stages.notify.digest",
  "version": "1.0.0",
  "purpose": "Static prompt with no variables, exercising the record format's floor.",
  "template": "Summarize today's queue in three bullet points.",
  "metadata": {
    "change_reason": "Initial version."
  }
}
